{
  "version": "cypher-llm-compatibility-catalog/v1",
  "generatedAt": "2026-05-10",
  "packageName": "@evalops/cypher-llm-compiler",
  "packageVersion": "0.1.0",
  "levels": [
    {
      "level": "stable",
      "title": "Stable Contract",
      "changePolicy": "No breaking structural changes inside the same contract version.",
      "consumerGuidance": "Safe for agent runtimes, CI gates, examples, and integrations to depend on."
    },
    {
      "level": "preview",
      "title": "Preview Contract",
      "changePolicy": "Compatible additions are preferred, but documented reshaping may occur before promotion to stable.",
      "consumerGuidance": "Safe for experiments and guarded integrations that pin package versions."
    },
    {
      "level": "experimental",
      "title": "Experimental Contract",
      "changePolicy": "Shape and semantics may change while the workstream is being discovered.",
      "consumerGuidance": "Use for fixtures, research, and opt-in trials; do not assume long-lived compatibility."
    }
  ],
  "contracts": [
    {
      "id": "cypher-query-ir",
      "version": "cypher-llm-ir/v1",
      "category": "ir",
      "level": "stable",
      "ownerWorkstreamId": "semantic-proof-repair",
      "schemaPath": "schemas/cypher-query.schema.json",
      "examplePaths": [
        "examples/tool-hash.query.json"
      ],
      "evidencePaths": [
        "src/ir.ts",
        "src/render.ts",
        "test/render.test.ts"
      ],
      "breakingChangePolicy": "Requires a new versioned contract or an explicit migration note before release.",
      "deprecationPolicy": "Stable consumers receive at least one minor release of notice plus a replacement or migration path."
    },
    {
      "id": "schema-contract",
      "version": "cypher-llm-schema/v1",
      "category": "schema",
      "level": "stable",
      "ownerWorkstreamId": "semantic-proof-repair",
      "schemaPath": "schemas/cypher-schema-contract.schema.json",
      "examplePaths": [
        "examples/tool-hash.schema.json"
      ],
      "evidencePaths": [
        "src/ir.ts",
        "src/schema.ts",
        "test/compiler-loop.test.ts"
      ],
      "breakingChangePolicy": "Requires a new versioned contract or an explicit migration note before release.",
      "deprecationPolicy": "Stable consumers receive at least one minor release of notice plus a replacement or migration path."
    },
    {
      "id": "diagnostic-shape",
      "version": "cypher-llm-diagnostic/v1",
      "category": "diagnostic",
      "level": "stable",
      "ownerWorkstreamId": "ecosystem-ux",
      "examplePaths": [
        "examples/lsp/tool-hash.lsp.json",
        "examples/proofs/tool-hash.proof.json"
      ],
      "evidencePaths": [
        "src/diagnostics.ts",
        "src/validate.ts",
        "docs/COMPATIBILITY.md"
      ],
      "breakingChangePolicy": "Requires a new versioned contract or an explicit migration note before release.",
      "deprecationPolicy": "Stable consumers receive at least one minor release of notice plus a replacement or migration path."
    },
    {
      "id": "eval-dataset",
      "version": "cypher-llm-eval-dataset/v1",
      "category": "eval",
      "level": "stable",
      "ownerWorkstreamId": "public-cypherbench",
      "schemaPath": "schemas/eval-dataset.schema.json",
      "examplePaths": [
        "examples/eval-dataset.json"
      ],
      "evidencePaths": [
        "src/evals.ts",
        "test/evals.test.ts"
      ],
      "breakingChangePolicy": "Requires a new versioned contract or an explicit migration note before release.",
      "deprecationPolicy": "Stable consumers receive at least one minor release of notice plus a replacement or migration path."
    },
    {
      "id": "eval-attempts",
      "version": "cypher-llm-eval-attempts/v1",
      "category": "eval",
      "level": "stable",
      "ownerWorkstreamId": "public-cypherbench",
      "schemaPath": "schemas/eval-attempts.schema.json",
      "examplePaths": [
        "examples/eval-attempts.json"
      ],
      "evidencePaths": [
        "src/evals.ts",
        "test/evals.test.ts"
      ],
      "breakingChangePolicy": "Requires a new versioned contract or an explicit migration note before release.",
      "deprecationPolicy": "Stable consumers receive at least one minor release of notice plus a replacement or migration path."
    },
    {
      "id": "dialect-profile",
      "version": "cypher-llm-dialect-profile/v1",
      "category": "dialect",
      "level": "stable",
      "ownerWorkstreamId": "dialect-certification",
      "schemaPath": "schemas/dialect-profile.schema.json",
      "examplePaths": [
        "profiles/neo4j-cypher-25.json",
        "profiles/opencypher-9.json",
        "profiles/gql.json"
      ],
      "evidencePaths": [
        "src/dialects.ts",
        "test/dialects.test.ts"
      ],
      "breakingChangePolicy": "Requires a new versioned contract or an explicit migration note before release.",
      "deprecationPolicy": "Stable consumers receive at least one minor release of notice plus a replacement or migration path."
    },
    {
      "id": "dialect-certification",
      "version": "cypher-llm-dialect-certification/v1",
      "category": "dialect",
      "level": "stable",
      "ownerWorkstreamId": "dialect-certification",
      "schemaPath": "schemas/dialect-certification.schema.json",
      "examplePaths": [
        "examples/certification/dialect-certification.json"
      ],
      "evidencePaths": [
        "src/dialect-certification.ts",
        "test/dialect-certification.test.ts"
      ],
      "breakingChangePolicy": "Requires a new versioned contract or an explicit migration note before release.",
      "deprecationPolicy": "Stable consumers receive at least one minor release of notice plus a replacement or migration path."
    },
    {
      "id": "proof",
      "version": "cypher-llm-proof/v1",
      "category": "proof",
      "level": "stable",
      "ownerWorkstreamId": "semantic-proof-repair",
      "schemaPath": "schemas/cypher-proof.schema.json",
      "examplePaths": [
        "examples/proofs/tool-hash.proof.json"
      ],
      "evidencePaths": [
        "src/proof.ts",
        "test/proof.test.ts"
      ],
      "breakingChangePolicy": "Requires a new versioned contract or an explicit migration note before release.",
      "deprecationPolicy": "Stable consumers receive at least one minor release of notice plus a replacement or migration path."
    },
    {
      "id": "repair-plan",
      "version": "cypher-llm-repair-plan/v1",
      "category": "repair",
      "level": "stable",
      "ownerWorkstreamId": "semantic-proof-repair",
      "schemaPath": "schemas/repair-plan.schema.json",
      "examplePaths": [
        "examples/proofs/tool-hash.repair-plan.json"
      ],
      "evidencePaths": [
        "src/repair-plan.ts",
        "test/repair-plan.test.ts"
      ],
      "breakingChangePolicy": "Requires a new versioned contract or an explicit migration note before release.",
      "deprecationPolicy": "Stable consumers receive at least one minor release of notice plus a replacement or migration path."
    },
    {
      "id": "agent-feedback",
      "version": "cypher-llm-agent-feedback/v1",
      "category": "agent-feedback",
      "level": "stable",
      "ownerWorkstreamId": "ecosystem-ux",
      "schemaPath": "schemas/agent-feedback.schema.json",
      "examplePaths": [
        "examples/proofs/tool-hash.agent-feedback.json"
      ],
      "evidencePaths": [
        "src/agent-feedback.ts",
        "test/agent-feedback.test.ts"
      ],
      "breakingChangePolicy": "Requires a new versioned contract or an explicit migration note before release.",
      "deprecationPolicy": "Stable consumers receive at least one minor release of notice plus a replacement or migration path."
    },
    {
      "id": "policy-report",
      "version": "cypher-llm-policy-report/v1",
      "category": "policy",
      "level": "stable",
      "ownerWorkstreamId": "cost-safety-policy",
      "schemaPath": "schemas/policy-report.schema.json",
      "examplePaths": [
        "examples/policy/tool-hash.policy.json"
      ],
      "evidencePaths": [
        "src/policy.ts",
        "test/policy.test.ts"
      ],
      "breakingChangePolicy": "Requires a new versioned contract or an explicit migration note before release.",
      "deprecationPolicy": "Stable consumers receive at least one minor release of notice plus a replacement or migration path."
    },
    {
      "id": "policy-profile-catalog",
      "version": "cypher-llm-policy-profile-catalog/v1",
      "category": "policy",
      "level": "stable",
      "ownerWorkstreamId": "cost-safety-policy",
      "schemaPath": "schemas/policy-profile.schema.json",
      "examplePaths": [
        "examples/policy/policy-profiles.json"
      ],
      "evidencePaths": [
        "src/policy-profile.ts",
        "test/policy-profile.test.ts"
      ],
      "breakingChangePolicy": "Requires a new versioned contract or an explicit migration note before release.",
      "deprecationPolicy": "Stable consumers receive at least one minor release of notice plus a replacement or migration path."
    },
    {
      "id": "policy-rules",
      "version": "cypher-llm-policy-rules/v1",
      "category": "policy",
      "level": "stable",
      "ownerWorkstreamId": "cost-safety-policy",
      "schemaPath": "schemas/policy-rules.schema.json",
      "examplePaths": [
        "examples/policy/tool-hash.policy-rules.json"
      ],
      "evidencePaths": [
        "src/policy-rules.ts",
        "test/policy.test.ts"
      ],
      "breakingChangePolicy": "Requires a new versioned contract or an explicit migration note before release.",
      "deprecationPolicy": "Stable consumers receive at least one minor release of notice plus a replacement or migration path."
    },
    {
      "id": "planner-estimate",
      "version": "cypher-llm-planner-estimate/v1",
      "category": "policy",